{
  "anomalies": [
    {
      "candidate_id": "response:000051",
      "codes": [
        "long_visible_pixel_gap"
      ],
      "series": "response"
    }
  ],
  "anomaly_candidate_count": 1,
  "candidate_count": 100,
  "candidates_path": "candidates.csv",
  "candidates_sha256": "754551dd47950ff4b919d03244338110e22ca8740713c8074cbce08c90b6d36b",
  "ordinary_candidate_count": 99,
  "ordinary_candidate_ids": [
    "response:000001",
    "response:000002",
    "response:000003",
    "response:000004",
    "response:000005",
    "response:000006",
    "response:000007",
    "response:000008",
    "response:000009",
    "response:000010",
    "response:000011",
    "response:000012",
    "response:000013",
    "response:000014",
    "response:000015",
    "response:000016",
    "response:000017",
    "response:000018",
    "response:000019",
    "response:000020",
    "response:000021",
    "response:000022",
    "response:000023",
    "response:000024",
    "response:000025",
    "response:000026",
    "response:000027",
    "response:000028",
    "response:000029",
    "response:000030",
    "response:000031",
    "response:000032",
    "response:000033",
    "response:000034",
    "response:000035",
    "response:000036",
    "response:000037",
    "response:000038",
    "response:000039",
    "response:000040",
    "response:000041",
    "response:000042",
    "response:000043",
    "response:000044",
    "response:000045",
    "response:000046",
    "response:000047",
    "response:000048",
    "response:000049",
    "response:000050",
    "response:000052",
    "response:000053",
    "response:000054",
    "response:000055",
    "response:000056",
    "response:000057",
    "response:000058",
    "response:000059",
    "response:000060",
    "response:000061",
    "response:000062",
    "response:000063",
    "response:000064",
    "response:000065",
    "response:000066",
    "response:000067",
    "response:000068",
    "response:000069",
    "response:000070",
    "response:000071",
    "response:000072",
    "response:000073",
    "response:000074",
    "response:000075",
    "response:000076",
    "response:000077",
    "response:000078",
    "response:000079",
    "response:000080",
    "response:000081",
    "response:000082",
    "response:000083",
    "response:000084",
    "response:000085",
    "response:000086",
    "response:000087",
    "response:000088",
    "response:000089",
    "response:000090",
    "response:000091",
    "response:000092",
    "response:000093",
    "response:000094",
    "response:000095",
    "response:000096",
    "response:000097",
    "response:000098",
    "response:000099",
    "response:000100"
  ],
  "safe_reextraction": {
    "attempted": true,
    "series": [
      {
        "accepted_additional_points": 0,
        "attempted": true,
        "method": "bounded_color_tolerance_retry_with_two_sided_path_residual_gate_v1",
        "original_points": 100,
        "original_tolerance": 36.0,
        "retry_ambiguous_columns": 0,
        "retry_tolerance": 45.0,
        "retry_visible_points": 100,
        "series": "response",
        "status": "no_safe_additions"
      }
    ],
    "source_sha256": "1bc8dccaf6b89e90aa75c81ef577962877e7c404439a70aee4f5465e46ebd059",
    "spec_sha256": "754fb6ddb0451047eb8a0d60b4e03d876bf64c6e889684cced3c06038051385f"
  },
  "schema": "morepaper.figure_candidate_quality.v1",
  "status": "needs_anomaly_review",
  "user_review_policy": {
    "anomaly": "requires an individual accept/reject/correct/reassign decision",
    "ordinary": "may be batch accepted by a user reply continue/下一步"
  }
}
